B1: 主要设备参数
A2: 主机 | B2: 序号 | C2: 设备名称 | D2: 制冷量 | E2: 功率 | F2: COP | G2: 台数 | H2: 品牌 | I2: 出厂时间
B3: 1 | C3: 水冷螺杆冷水机组 | D3: 840.30kW/240RT | E3: 159.6 | F3: 5.26 | G3: 2 | H3: 特灵 | I3: 2012年
A5: 水泵 | B5: 序号 | C5: 设备名称 | D5: 功率 | E5: 扬程 | F5: 流量 | G5: 台数 | H5: 品牌 | I5: 出厂时间
B6: 1 | C6: 冷冻水泵 | D6: 30 | E6: 32 | F6: 200 | G6: 2 | H6: 佛山水泵 | I6: 2012年
B7: 2 | C7: 冷却水泵 | D7: 30 | E7: 32 | F7: 200 | G7: 2 | H7: 佛山水泵 | I7: 2012年
A9: 冷却塔 | B9: 序号 | C9: 设备名称 | D9: 功率 | E9: 流量 | F9: 台数 | G9: 品牌 | H9: 出厂时间
B10: 1 | C10: 冷却塔 | D10: 7.5*2 | E10: 450 | F10: 1 | G10: 明新 | H10: 2012年
A13: 表计 | B13: 能耗 | C13: 用电量 | D13: 用电量 | F13: 用电量 | G13: 2023年 | H13: 2024年
C14: 电表①*100 | D14: 电表②*100 | F14: 11月 | G14: =C15+D15 -> 230500 | H14: =C27+D27 -> 53500
B15: 44866. | C15: =('[项目计算书-佛山市第三人民医院20250425(1).html]原始数据'!H5-'[项目计算书-佛山市第三人民医院20250425(1).html]原始数据'!H4)*100 -> 17300 | D15: =('[项目计算书-佛山市第三人民医院20250425(1).html]原始数据'!I5-'[项目计算书-佛山市第三人民医院20250425(1).html]原始数据'!I4)*100 -> 213200 | F15: 12月 | G15: =C16+D16 -> 100 | H15: =C28+D28 -> 22200
B16: 44896. | C16: =('[项目计算书-佛山市第三人民医院20250425(1).html]原始数据'!H6-'[项目计算书-佛山市第三人民医院20250425(1).html]原始数据'!H5)*100 -> 100 | D16: =('[项目计算书-佛山市第三人民医院20250425(1).html]原始数据'!I6-'[项目计算书-佛山市第三人民医院20250425(1).html]原始数据'!I5)*100 -> 0 | F16: 1月 | G16: =C17+D17 -> 4300 | H16: =C29+D29 -> 400
B17: 44927. | C17: 100 | D17: =('[项目计算书-佛山市第三人民医院20250425(1).html]原始数据'!I7-'[项目计算书-佛山市第三人民医院20250425(1).html]原始数据'!I6)*100 -> 4200 | F17: 2月 | G17: =C18+D18 -> 100 | H17: =C30+D30 -> 400
B18: 44958. | C18: 100 | D18: =('[项目计算书-佛山市第三人民医院20250425(1).html]原始数据'!I8-'[项目计算书-佛山市第三人民医院20250425(1).html]原始数据'!I7)*100 -> 0 | F18: 3月 | G18: =C19+D19 -> 19200 | H18: =C31+D31 -> 400
B19: 44986. | C19: =('[项目计算书-佛山市第三人民医院20250425(1).html]原始数据'!H9-'[项目计算书-佛山市第三人民医院20250425(1).html]原始数据'!H8)*100 -> 17900 | D19: =('[项目计算书-佛山市第三人民医院20250425(1).html]原始数据'!I9-'[项目计算书-佛山市第三人民医院20250425(1).html]原始数据'!I8)*100 -> 1300 | F19: 4月 | G19: =C20+D20 -> 77200 | H19: =C32+D32 -> 104000
B20: 45017. | C20: =('[项目计算书-佛山市第三人民医院20250425(1).html]原始数据'!H10-'[项目计算书-佛山市第三人民医院20250425(1).html]原始数据'!H9)*100 -> 62400 | D20: =('[项目计算书-佛山市第三人民医院20250425(1).html]原始数据'!I10-'[项目计算书-佛山市第三人民医院20250425(1).html]原始数据'!I9)*100 -> 14800 | F20: 5月 | G20: =C21+D21 -> 149100 | H20: =C33+D33 -> 66300
B21: 45047. | C21: =('[项目计算书-佛山市第三人民医院20250425(1).html]原始数据'!H11-'[项目计算书-佛山市第三人民医院20250425(1).html]原始数据'!H10)*100 -> 88700 | D21: =('[项目计算书-佛山市第三人民医院20250425(1).html]原始数据'!I11-'[项目计算书-佛山市第三人民医院20250425(1).html]原始数据'!I10)*100 -> 60400 | F21: 6月 | G21: =C22+D22 -> 179000 | H21: =C34+D34 -> 183400
B22: 45078. | C22: =('[项目计算书-佛山市第三人民医院20250425(1).html]原始数据'!H12-'[项目计算书-佛山市第三人民医院20250425(1).html]原始数据'!H11)*100 -> 80900 | D22: =('[项目计算书-佛山市第三人民医院20250425(1).html]原始数据'!I12-'[项目计算书-佛山市第三人民医院20250425(1).html]原始数据'!I11)*100 -> 98100 | F22: 7月 | G22: =C23+D23 -> 182400 | H22: =C35+D35 -> 208500
B23: 45108. | C23: =('[项目计算书-佛山市第三人民医院20250425(1).html]原始数据'!H13-'[项目计算书-佛山市第三人民医院20250425(1).html]原始数据'!H12)*100 -> 82500 | D23: =('[项目计算书-佛山市第三人民医院20250425(1).html]原始数据'!I13-'[项目计算书-佛山市第三人民医院20250425(1).html]原始数据'!I12)*100 -> 99900 | F23: 8月 | G23: =C24+D24 -> 180800 | H23: =C36+D36 -> 163100
B24: 45139. | C24: =('[项目计算书-佛山市第三人民医院20250425(1).html]原始数据'!H14-'[项目计算书-佛山市第三人民医院20250425(1).html]原始数据'!H13)*100 -> 83600 | D24: =('[项目计算书-佛山市第三人民医院20250425(1).html]原始数据'!I14-'[项目计算书-佛山市第三人民医院20250425(1).html]原始数据'!I13)*100 -> 97200 | F24: 9月 | G24: =C25+D25 -> 139700 | H24: =C37+D37 -> 172000
B25: 45170. | C25: =('[项目计算书-佛山市第三人民医院20250425(1).html]原始数据'!H15-'[项目计算书-佛山市第三人民医院20250425(1).html]原始数据'!H14)*100 -> 73800 | D25: =('[项目计算书-佛山市第三人民医院20250425(1).html]原始数据'!I15-'[项目计算书-佛山市第三人民医院20250425(1).html]原始数据'!I14)*100 -> 65900 | F25: 10月 | G25: =C26+D26 -> 116600 | H25: =C38+D38 -> 106800
B26: 45200. | C26: =('[项目计算书-佛山市第三人民医院20250425(1).html]原始数据'!H16-'[项目计算书-佛山市第三人民医院20250425(1).html]原始数据'!H15)*100 -> 86200 | D26: =('[项目计算书-佛山市第三人民医院20250425(1).html]原始数据'!I16-'[项目计算书-佛山市第三人民医院20250425(1).html]原始数据'!I15)*100 -> 30400 | F26: 合计 | G26: =SUM(G14:G25) -> 1279000 | H26: =SUM(H14:H25) -> 1081000
B27: 45231. | C27: =('[项目计算书-佛山市第三人民医院20250425(1).html]原始数据'!H17-'[项目计算书-佛山市第三人民医院20250425(1).html]原始数据'!H16)*100 -> 41600 | D27: =('[项目计算书-佛山市第三人民医院20250425(1).html]原始数据'!I17-'[项目计算书-佛山市第三人民医院20250425(1).html]原始数据'!I16)*100 -> 11900
B28: 45261. | C28: =('[项目计算书-佛山市第三人民医院20250425(1).html]原始数据'!H18-'[项目计算书-佛山市第三人民医院20250425(1).html]原始数据'!H17)*100 -> 400 | D28: =('[项目计算书-佛山市第三人民医院20250425(1).html]原始数据'!I18-'[项目计算书-佛山市第三人民医院20250425(1).html]原始数据'!I17)*100 -> 21800
B29: 45292. | C29: =('[项目计算书-佛山市第三人民医院20250425(1).html]原始数据'!H19-'[项目计算书-佛山市第三人民医院20250425(1).html]原始数据'!H18)*100 -> 400 | D29: =('[项目计算书-佛山市第三人民医院20250425(1).html]原始数据'!I19-'[项目计算书-佛山市第三人民医院20250425(1).html]原始数据'!I18)*100 -> 0 | F29: 节能量评估 | G29: 以2024年为基准
B30: 45323. | C30: =('[项目计算书-佛山市第三人民医院20250425(1).html]原始数据'!H20-'[项目计算书-佛山市第三人民医院20250425(1).html]原始数据'!H19)*100 -> 300 | D30: =('[项目计算书-佛山市第三人民医院20250425(1).html]原始数据'!I20-'[项目计算书-佛山市第三人民医院20250425(1).html]原始数据'!I19)*100 -> 100 | F30: 改造前能效EER | G30: 2.6
B31: 45352. | C31: =('[项目计算书-佛山市第三人民医院20250425(1).html]原始数据'!H21-'[项目计算书-佛山市第三人民医院20250425(1).html]原始数据'!H20)*100 -> 300 | D31: =('[项目计算书-佛山市第三人民医院20250425(1).html]原始数据'!I21-'[项目计算书-佛山市第三人民医院20250425(1).html]原始数据'!I20)*100 -> 100 | F31: 改造前制冷量kWh | G31: =H26*G30 -> 2810600
B32: 45383. | C32: =('[项目计算书-佛山市第三人民医院20250425(1).html]原始数据'!H22-'[项目计算书-佛山市第三人民医院20250425(1).html]原始数据'!H21)*100 -> 86300 | D32: =('[项目计算书-佛山市第三人民医院20250425(1).html]原始数据'!I22-'[项目计算书-佛山市第三人民医院20250425(1).html]原始数据'!I21)*100 -> 17700
B33: 45413. | C33: =('[项目计算书-佛山市第三人民医院20250425(1).html]原始数据'!H23-'[项目计算书-佛山市第三人民医院20250425(1).html]原始数据'!H22)*100 -> 34000 | D33: =('[项目计算书-佛山市第三人民医院20250425(1).html]原始数据'!I23-'[项目计算书-佛山市第三人民医院20250425(1).html]原始数据'!I22)*100 -> 32300 | F33: 改造后能效EER | G33: 5.6
B34: 45444. | C34: =('[项目计算书-佛山市第三人民医院20250425(1).html]原始数据'!H24-'[项目计算书-佛山市第三人民医院20250425(1).html]原始数据'!H23)*100 -> 46300 | D34: =('[项目计算书-佛山市第三人民医院20250425(1).html]原始数据'!I24-'[项目计算书-佛山市第三人民医院20250425(1).html]原始数据'!I23)*100 -> 137100 | F34: 改造后能耗kWh | G34: =G31/G33 -> 501892.85714285716
B35: 45474. | C35: =('[项目计算书-佛山市第三人民医院20250425(1).html]原始数据'!H25-'[项目计算书-佛山市第三人民医院20250425(1).html]原始数据'!H24)*100 -> 92600 | D35: =('[项目计算书-佛山市第三人民医院20250425(1).html]原始数据'!I25-'[项目计算书-佛山市第三人民医院20250425(1).html]原始数据'!I24)*100 -> 115900
B36: 45505. | C36: =('[项目计算书-佛山市第三人民医院20250425(1).html]原始数据'!H26-'[项目计算书-佛山市第三人民医院20250425(1).html]原始数据'!H25)*100 -> 67500 | D36: =('[项目计算书-佛山市第三人民医院20250425(1).html]原始数据'!I26-'[项目计算书-佛山市第三人民医院20250425(1).html]原始数据'!I25)*100 -> 95600 | F36: 节能量kWh | G36: =H26-G34 -> 579107.14285714284
B37: 45536. | C37: =('[项目计算书-佛山市第三人民医院20250425(1).html]原始数据'!H27-'[项目计算书-佛山市第三人民医院20250425(1).html]原始数据'!H26)*100 -> 96100 | D37: =('[项目计算书-佛山市第三人民医院20250425(1).html]原始数据'!I27-'[项目计算书-佛山市第三人民医院20250425(1).html]原始数据'!I26)*100 -> 75900 | F37: 节省费用元 | G37: =G36*'[项目计算书-佛山市第三人民医院20250425(1).html]原始数据'!E6 -> 460683.36704077438
B38: 45566. | C38: =('[项目计算书-佛山市第三人民医院20250425(1).html]原始数据'!H28-'[项目计算书-佛山市第三人民医院20250425(1).html]原始数据'!H27)*100 -> 75800 | D38: =('[项目计算书-佛山市第三人民医院20250425(1).html]原始数据'!I28-'[项目计算书-佛山市第三人民医院20250425(1).html]原始数据'!I27)*100 -> 31000 | F38: 节能率 | G38: =G36/H26 -> 0.5357142857142857
F40: 改造措施：（1）更换2台磁悬浮制冷主机；（2）更换2台冷冻水泵，更换2台冷却水泵；（3）更换2台冷却塔（原只有一台冷却塔）（4）更换机房强弱电系统；（5）搭建平台及智能群控系统