A1: 原始灯具数量
A2: 灯具类型和规格 | B2: 病房区、公共区域（走廊）
B3: 数量/个 | C3: 年度照明时长/h | D3: 数量/个 | E3: 年度照明时长/h
A4: 600*600面板灯（42w） | B4: 94 | C4: 3650 | D4: 0 | E4: 3650
A5: 300*300面板灯（22w） | B5: 17 | C5: 3650 | D5: 0 | E5: 3650
A6: 1.2米T8光管（15w） | B6: 20 | C6: 3650 | D6: 0 | E6: 3650
A7: 0.9米T8光管（11w） | B7: 3 | C7: 3650 | D7: 0 | E7: 3650
A8: 0.6米T8光管（9w） | B8: 123 | C8: 3650 | D8: 0 | E8: 3650
A9: 1.2米T5光管（14w） | B9: 846 | C9: 3650 | D9: 0 | E9: 3650
A10: 0.6米T5光管（8w） | B10: 3043 | C10: 3650 | D10: 0 | E10: 3650
A11: 1.2米LED支架灯（13w） | B11: 615 | C11: 3650 | D11: 0 | E11: 3650 | F11: T8
A12: 0.9米LED支架灯（9.6w） | B12: 41 | C12: 3650 | D12: 0 | E12: 3650
A13: 筒灯（18w） | B13: 5 | C13: 3650 | D13: 0 | E13: 3650
A14: 灯泡（6.5w） | B14: 855 | C14: 3650 | D14: 0 | E14: 3650
A15: 总计 | B15: 5662 | D15: 0
C17: 改造前 | F17: 改造后 | I17: 节能量（kWh)
C18: 功率W（改造前） | D18: 病房区、公共区域（走廊）(kWh) | F18: 功率W（改造后） | G18: 病房区、公共区域（走廊）(kWh)
A19: 照明系统改造节能量 | B19: 600*600面板灯 | C19: 42 | D19: =C19*B4*C4/1000 -> 14410.2 | F19: 24 | G19: =F19*B4*C4/1000 -> 8234.4 | I19: =(D19+E19)-(G19+H19) -> 6175.8
B20: 300*300面板灯 | C20: 22 | D20: =C20*B5*C5/1000 -> 1365.1 | F20: 14 | G20: =F20*B5*C5/1000 -> 868.7 | I20: =(D20+E20)-(G20+H20) -> 496.4
B21: 1.2米T8光管 | C21: 15 | D21: =C21*B6*C6/1000 -> 1095 | F21: 5 | G21: =F21*B6*C6/1000 -> 365 | I21: =(D21+E21)-(G21+H21) -> 730
B22: 0.9米T8光管 | C22: 11 | D22: =C22*B7*C7/1000 -> 120.45 | F22: 4 | G22: =F22*B7*C7/1000 -> 43.8 | I22: =(D22+E22)-(G22+H22) -> 76.65
B23: 0.6米T8光管 | C23: 9 | D23: =C23*B8*C8/1000 -> 4040.55 | F23: 3 | G23: =F23*B8*C8/1000 -> 1346.85 | I23: =(D23+E23)-(G23+H23) -> 2693.7
B24: 1.2米T5光管 | C24: 14 | D24: =C24*B9*C9/1000 -> 43230.6 | F24: 5 | G24: =F24*B9*C9/1000 -> 15439.5 | I24: =(D24+E24)-(G24+H24) -> 27791.1
B25: 0.6米T5光管 | C25: 8 | D25: =C25*B10*C10/1000 -> 88855.6 | F25: 3 | G25: =F25*B10*C10/1000 -> 33320.85 | I25: =(D25+E25)-(G25+H25) -> 55534.75
B26: 1.2米LED支架灯 | C26: 13 | D26: =C26*B11*C11/1000 -> 29181.75 | F26: 5 | G26: =F26*B11*C11/1000 -> 11223.75 | I26: =(D26+E26)-(G26+H26) -> 17958
B27: 0.9米LED支架灯 | C27: 9.6 | D27: =C27*B12*C12/1000 -> 1436.64 | F27: 3 | G27: =F27*B12*C12/1000 -> 448.95 | I27: =(D27+E27)-(G27+H27) -> 987.69
B28: 筒灯 | C28: 18 | D28: =C28*B13*C13/1000 -> 328.5 | F28: 8 | G28: =F28*B13*C13/1000 -> 146 | I28: =(D28+E28)-(G28+H28) -> 182.5
B29: 灯泡 | C29: 6.5 | D29: =C29*B14*C14/1000 -> 20284.875 | F29: 4 | G29: =F29*B14*C14/1000 -> 12483 | I29: =(D29+E29)-(G29+H29) -> 7801.875
B30: 小计 | C30: / | D30: =SUM(D19:D29) -> 204349.26500000001 | F30: / | G30: =SUM(G19:G29) -> 83920.8 | I30: =SUM(I19:I29) -> 120428.46500000001 | J30: 节能收益/元
B31: 合计 | D31: =SUM(D30:E30) -> 204349.265 | G31: =SUM(G30:H30) -> 83920.8 | I31: =I30 -> 120428.46500000001 | J31: =I31*'[项目计算书-佛山市第三人民医院20250425(1).html]原始数据'!D6 -> 90047.707915474879
I32: =I31/D31 -> 0.58932663643297178