B1: 主要设备参数
A2: 热泵 | B2: 序号 | C2: 设备名称 | D2: 制热量kW | E2: 功率kW | F2: 台数 | G2: 出厂时间
B3: 1 | C3: 空气源热泵 | D3: 40 | E3: 9.52 | F3: 5 | G3: 2012
A5: 表计 | B5: 能耗 | C5: 电表①*50 | D5: 电表②*50 | F5: 用电量 | G5: 2023/年kWh
B6: 44927. | C6: =('[项目计算书-佛山市第三人民医院20250425(1).html]原始数据'!J6-'[项目计算书-佛山市第三人民医院20250425(1).html]原始数据'!J5)*50 -> 15350 | D6: =('[项目计算书-佛山市第三人民医院20250425(1).html]原始数据'!K6-'[项目计算书-佛山市第三人民医院20250425(1).html]原始数据'!K5)*50 -> 13200 | F6: 1月 | G6: =C6+D6 -> 28550
B7: 44958. | C7: =('[项目计算书-佛山市第三人民医院20250425(1).html]原始数据'!J7-'[项目计算书-佛山市第三人民医院20250425(1).html]原始数据'!J6)*50 -> 21900 | D7: =('[项目计算书-佛山市第三人民医院20250425(1).html]原始数据'!K7-'[项目计算书-佛山市第三人民医院20250425(1).html]原始数据'!K6)*50 -> 0 | F7: 2月 | G7: =C7+D7 -> 21900
B8: 44986. | C8: =('[项目计算书-佛山市第三人民医院20250425(1).html]原始数据'!J8-'[项目计算书-佛山市第三人民医院20250425(1).html]原始数据'!J7)*50 -> 21800 | D8: =('[项目计算书-佛山市第三人民医院20250425(1).html]原始数据'!K8-'[项目计算书-佛山市第三人民医院20250425(1).html]原始数据'!K7)*50 -> 1300 | F8: 3月 | G8: =C8+D8 -> 23100
B9: 45017. | C9: =('[项目计算书-佛山市第三人民医院20250425(1).html]原始数据'!J9-'[项目计算书-佛山市第三人民医院20250425(1).html]原始数据'!J8)*50 -> 10800 | D9: =('[项目计算书-佛山市第三人民医院20250425(1).html]原始数据'!K9-'[项目计算书-佛山市第三人民医院20250425(1).html]原始数据'!K8)*50 -> 19450 | F9: 4月 | G9: =C9+D9 -> 30250
B10: 45047. | C10: =('[项目计算书-佛山市第三人民医院20250425(1).html]原始数据'!J10-'[项目计算书-佛山市第三人民医院20250425(1).html]原始数据'!J9)*50 -> 20100 | D10: =('[项目计算书-佛山市第三人民医院20250425(1).html]原始数据'!K10-'[项目计算书-佛山市第三人民医院20250425(1).html]原始数据'!K9)*50 -> 7200 | F10: 5月 | G10: =C10+D10 -> 27300
B11: 45078. | C11: =('[项目计算书-佛山市第三人民医院20250425(1).html]原始数据'!J11-'[项目计算书-佛山市第三人民医院20250425(1).html]原始数据'!J10)*50 -> 16000 | D11: =('[项目计算书-佛山市第三人民医院20250425(1).html]原始数据'!K11-'[项目计算书-佛山市第三人民医院20250425(1).html]原始数据'!K10)*50 -> 15450 | F11: 6月 | G11: =C11+D11 -> 31450
B12: 45108. | C12: =('[项目计算书-佛山市第三人民医院20250425(1).html]原始数据'!J12-'[项目计算书-佛山市第三人民医院20250425(1).html]原始数据'!J11)*50 -> 11650 | D12: =('[项目计算书-佛山市第三人民医院20250425(1).html]原始数据'!K12-'[项目计算书-佛山市第三人民医院20250425(1).html]原始数据'!K11)*50 -> 9250 | F12: 7月 | G12: =C12+D12 -> 20900
B13: 45139. | C13: =('[项目计算书-佛山市第三人民医院20250425(1).html]原始数据'!J13-'[项目计算书-佛山市第三人民医院20250425(1).html]原始数据'!J12)*50 -> 14750 | D13: =('[项目计算书-佛山市第三人民医院20250425(1).html]原始数据'!K13-'[项目计算书-佛山市第三人民医院20250425(1).html]原始数据'!K12)*50 -> 3100 | F13: 8月 | G13: =C13+D13 -> 17850
B14: 45170. | C14: =('[项目计算书-佛山市第三人民医院20250425(1).html]原始数据'!J14-'[项目计算书-佛山市第三人民医院20250425(1).html]原始数据'!J13)*50 -> 9350 | D14: =('[项目计算书-佛山市第三人民医院20250425(1).html]原始数据'!K14-'[项目计算书-佛山市第三人民医院20250425(1).html]原始数据'!K13)*50 -> 4750 | F14: 9月 | G14: =C14+D14 -> 14100
B15: 45200. | C15: =('[项目计算书-佛山市第三人民医院20250425(1).html]原始数据'!J15-'[项目计算书-佛山市第三人民医院20250425(1).html]原始数据'!J14)*50 -> 16350 | D15: =('[项目计算书-佛山市第三人民医院20250425(1).html]原始数据'!K15-'[项目计算书-佛山市第三人民医院20250425(1).html]原始数据'!K14)*50 -> 0 | F15: 10月 | G15: =C15+D15 -> 16350
B16: 45231. | C16: =('[项目计算书-佛山市第三人民医院20250425(1).html]原始数据'!J16-'[项目计算书-佛山市第三人民医院20250425(1).html]原始数据'!J15)*50 -> 16600 | D16: =('[项目计算书-佛山市第三人民医院20250425(1).html]原始数据'!K16-'[项目计算书-佛山市第三人民医院20250425(1).html]原始数据'!K15)*50 -> 1200 | F16: 11月 | G16: =C16+D16 -> 17800
B17: 45261. | C17: =('[项目计算书-佛山市第三人民医院20250425(1).html]原始数据'!J17-'[项目计算书-佛山市第三人民医院20250425(1).html]原始数据'!J16)*50 -> 14300 | D17: =('[项目计算书-佛山市第三人民医院20250425(1).html]原始数据'!K17-'[项目计算书-佛山市第三人民医院20250425(1).html]原始数据'!K16)*50 -> 600 | F17: 12月 | G17: =C17+D17 -> 14900
F18: 合计 | G18: =SUM(G6:G17) -> 264450
B19: 备注：2024年数据不全，采用2023年全年数据作为基准
F22: 改造措施：（1）在屋面新增光热热水器，预估可安装面积100m2,安装光热板40块（2000*1000*80），接入原生活热水管路，辅助空气源热泵制备生活热水；（2）新增热水控制系统。
C26: 节能量评估 | D26: 以2023年为基准
C27: 改造前能效COP | D27: 3.73
C28: 改造前制热量kWh | D28: =G18*D27 -> 986398.5 | F28: 预估节能率 | G28: 0.40000000000000002
F29: 节能量kWh | G29: =G18*0.4 -> 105780
C30: 改造后能效COP | D30: 5.5 | F30: 节能收益/元 | G30: =G29*'[项目计算书-佛山市第三人民医院20250425(1).html]原始数据'!E5 -> 0.
C31: 改造后能耗kWh | D31: =D28/D30 -> 179345.18181818182
C35: 节能量kWh | D35: =G18-D31 -> 85104.818181818177
C36: 节能收益/元 | D36: =D35*F40 -> 0.
C37: 预估节能率 | D37: /