A1: 医院近3年全院用电总量和费用 | F1: 热水系统和中央空调用电量统计表
A2: 时间 | B2: 2021年 | C2: 2022年 | D2: 2023年 | F2: 电表读数 | G2: 中央空调系统用电量 | I2: 热水系统用电量 | M2: 灯具类型和规格 | N2: 行政办公区 | P2: 病房区、公共区域（走廊）
A3: 用电度数（万千万时） | B3: 613.07 | C3: 590.83 | D3: 579.92 | G3: 电表①*100 | H3: 电表②*100 | I3: 电表①*50 | J3: 电表②*50 | N3: 数量/个 | O3: 年度照明时长/h | P3: 数量/个 | Q3: 年度照明时长/h
A4: 电费金额（万元） | B4: 411.15 | C4: 441.78 | D4: 461.33 | F4: 表底数 | G4: 64091 | H4: 37793 | I4: 5656 | J4: 6334 | M4: 600*600面板灯（42w） | N4: 87 | O4: 2000 | P4: 355 | Q4: 3650
F5: 44866. | G5: 64264 | H5: 39925 | I5: 5905 | J5: 6725 | M5: 300*300面板灯（22w） | N5: 7 | O5: 2000 | P5: 53 | Q5: 3650
A6: 单价 | B6: =B4/B3 -> 0.67064119921053056 | C6: =C4/C3 -> 0.74772777279420466 | D6: =D4/D3 -> 0.79550627672782459 | F6: 44896. | G6: 64265 | H6: 39925 | I6: 6212 | J6: 6989 | M6: 1.2米T8光管（15w） | N6: 52 | O6: 2000 | P6: 580 | Q6: 3650
F7: 44927. | G7: - | H7: 39967 | I7: 6650 | J7: 6989 | M7: 0.9米T8光管（11w） | N7: 1 | O7: 2000 | P7: 7 | Q7: 3650
D8: =D3*10000 -> 5799200 | F8: 44958. | G8: 64267 | H8: 39967 | I8: 7086 | J8: 7015 | M8: 0.6米T8光管（9w） | N8: 79 | O8: 2000 | P8: 904 | Q8: 3650
D9: 52258 | F9: 44986. | G9: 64446 | H9: 39980 | I9: 7302 | J9: 7404 | M9: 1.2米T5光管（14w） | N9: 0 | O9: 2000 | P9: 846 | Q9: 3650
F10: 45017. | G10: 65070 | H10: 40128 | I10: 7704 | J10: 7548 | M10: 0.6米T5光管（8w） | N10: 885 | O10: 2000 | P10: 3043 | Q10: 3650
D11: =D8/D9 -> 110.97248268207738 | F11: 45047. | G11: 65957 | H11: 40732 | I11: 8024 | J11: 7857 | M11: 1.2米LED支架灯（13w） | N11: 227 | O11: 2000 | P11: 615 | Q11: 3650
D12: =D11*0.31 -> 34.401469631443987 | F12: 45078. | G12: 66766 | H12: 41713 | I12: 8257 | J12: 8042 | M12: 0.9米LED支架灯（9.6w） | N12: 0 | O12: 2000 | P12: 41 | Q12: 3650
F13: 45108. | G13: 67591 | H13: 42712 | I13: 8552 | J13: 8104 | M13: 筒灯（18w） | N13: 42 | O13: 2000 | P13: 5 | Q13: 3650
F14: 45139. | G14: 68427 | H14: 43684 | I14: 8739 | J14: 8199 | M14: 灯泡（6.5w） | N14: 283 | O14: 2000 | P14: 906 | Q14: 3650
F15: 45170. | G15: 69165 | H15: 44343 | I15: 9066 | J15: 8199 | M15: 合计 | N15: 1663 | P15: 7355
F16: 45200. | G16: 70027 | H16: 44647 | I16: 9398 | J16: 8223 | M16: 说明：
F17: 45231. | G17: 70443 | H17: 44766 | I17: 9684 | J17: 8235 | M17: 1. 行政办公区照明时长按照每天8h计，年工作日数250天。行政办公区的走廊通道照明改造后需实现人走灯半亮，人到灯全亮感应功能。
F18: 45261. | G18: 70447 | H18: 44984 | I18: 10100 | J18: 8255 | M18: 2. 病房区域（含走廊、医生护士办公室）照明时长按每天10h，年工作日365天。
F19: 45292. | G19: 70451 | H19: 44984 | I19: 10695 | J19: 8280
F20: 45323. | G20: 70454 | H20: 44985 | I20: 11161 | J20: 8302
F21: 45352. | G21: 70457 | H21: 44986 | I21: 11697 | J21: 8317
F22: 45383. | G22: 71320 | H22: 45163 | I22: 12215 | J22: 8317
F23: 45413. | G23: 71660 | H23: 45486 | I23: - | J23: -
F24: 45444. | G24: 72123 | H24: 46857 | I24: 13058 | J24: 8317
F25: 45474. | G25: 73049 | H25: 48016 | I25: 13487 | J25: 8317
F26: 45505. | G26: 73724 | H26: 48972 | I26: 13876 | J26: -
F27: 45536. | G27: 74685 | H27: 49731 | I27: - | J27: -
F28: 45566. | G28: 75443 | H28: 50041 | I28: 14737 | J28: 8317
F29: 说明：
F30: 1、热水系统和中央空调系统用电量统计从2022年11月开始登记；
F31: 2、热水系统和中央空调各有2个电表控制，其中热水系统的电表②目前已是故障停止运行，无法测量实际用电量；
F32: 3、测量电表为2021年我院1号大楼建设时期安装，多年来未有送检校验，不排除电表计量与实际用量出现偏差大的可能性，以上数据仅供参考。
F33: 4、中央空调系统用电量包含冷水机组、水泵、冷却塔，热水系统用电量包含热泵、循环泵。